{
  "$schema": "https://json-schema.org/draft/2020-12/schema",
  "$id": "urn:heuristic-commerce:schema:page:v1",
  "title": "Heuristic Page",
  "type": "object",
  "required": ["id", "route", "title", "sections"],
  "properties": {
    "id": { "type": "string", "pattern": "^[a-z0-9-]+$" },
    "route": { "type": "string", "pattern": "^/" },
    "title": { "type": "string", "minLength": 1, "maxLength": 120 },
    "sections": {
      "type": "array",
      "minItems": 1,
      "items": { "$ref": "./section.schema.json" }
    }
  },
  "additionalProperties": false
}
